{
  "@context": "https://www.3se.info/3se-onto/contexts/domain.context.jsonld",
  "@type": "skos:Collection",
  "title": "Requirements engineering - 3SE",
  "description": "Domain covering the specification of stakeholder requirements from features and attributes, and their refinement into system requirements.",
  "status": "draft",
  "members": [
    "https://www.3se.info/3se-onto/terms/stakeholder-req-analysis-3se-069b9d2c8df07af5",
    "https://www.3se.info/3se-onto/terms/system-req-analysis-3se-069ee3cda5ec743c"
  ]
}
